{
  "schemaVersion": 1,
  "family": "Vector UI",
  "pack": "rounded",
  "nameStatus": "working-name",
  "version": "0.1.0-soft-pilot",
  "status": "calibration-pilot-not-public",
  "public": false,
  "counts": {
    "icons": 12,
    "drawings": 72
  },
  "icons": [
    {
      "id": "home",
      "label": "Home",
      "category": "navigation",
      "pairModel": "silhouette",
      "meaning": "Home or top-level destination. Do not substitute for Back.",
      "keywords": ["dashboard", "main"],
      "availability": {"rounded": {"appearances": ["outline", "filled"], "opticalSizes": [12, 16, 24]}},
      "review": {
        "note": "One rounded pentagon: ACUTE_JOIN gable and shoulders, CORNER_TOKEN feet, apex on the top keyline. 16 px door is narrower and sits lower so the outline still reads as a house.",
        "usage": "Use the action name on the enclosing control; 12 px is for labeled information."
      }
    },
    {
      "id": "search",
      "label": "Search",
      "category": "navigation",
      "pairModel": "weight",
      "meaning": "Find content. A heavier lens still has an open center.",
      "keywords": ["find", "lookup"],
      "availability": {"rounded": {"appearances": ["outline", "filled"], "opticalSizes": [12, 16, 24]}},
      "review": {
        "note": "Circular lens and capsule handle. The octagon is Outline; Rounded must not use it.",
        "usage": "Use the action name on the enclosing control; 12 px is for labeled information."
      }
    },
    {
      "id": "plus",
      "label": "Plus",
      "category": "actions",
      "pairModel": "weight",
      "meaning": "Add or create. Distinct from expand and zoom-in.",
      "keywords": ["add", "new", "create"],
      "availability": {"rounded": {"appearances": ["outline", "filled"], "opticalSizes": [12, 16, 24]}},
      "review": {
        "note": "Two crossing capsules. Round terminals are the Rounded tell versus Outline square caps.",
        "usage": "Use the action name on the enclosing control; 12 px is for labeled information."
      }
    },
    {
      "id": "arrow-right",
      "label": "Arrow right",
      "category": "navigation",
      "pairModel": "weight",
      "meaning": "A literal right arrow. Navigation direction must be chosen by the application.",
      "keywords": ["next", "forward"],
      "availability": {"rounded": {"appearances": ["outline", "filled"], "opticalSizes": [12, 16, 24]}},
      "review": {
        "note": "One continuous round-capped shaft into a round-joined head, at a 45-degree half-angle and a two-thirds-canvas span on all six drawings. The outline 12 shaft sits on a pixel row, a registered 0.5 px offset from its filled partner.",
        "usage": "The application chooses left/right; artwork does not auto-mirror."
      }
    },
    {
      "id": "user",
      "label": "User",
      "category": "people-communication",
      "pairModel": "silhouette",
      "meaning": "A person or profile.",
      "keywords": ["person", "account"],
      "availability": {"rounded": {"appearances": ["outline", "filled"], "opticalSizes": [12, 16, 24]}},
      "review": {
        "note": "Circular head over a dome torso: broad shoulder circles and smaller base corners. Outline uses an octagonal head.",
        "usage": "Use the action name on the enclosing control; 12 px is for labeled information."
      }
    },
    {
      "id": "file",
      "label": "File",
      "category": "content",
      "pairModel": "silhouette",
      "meaning": "A document. Not a duplicate action.",
      "keywords": ["document", "page"],
      "availability": {"rounded": {"appearances": ["outline", "filled"], "opticalSizes": [12, 16, 24]}},
      "review": {
        "note": "Portrait page with CORNER_TOKEN on its three page corners and a turned-down corner: solid in outline, where a counter would be a sub-pixel pocket, and split off by a gap-target slit in filled. Two unequal left-aligned lines at 24 px only.",
        "usage": "Use the action name on the enclosing control; 12 px is for labeled information."
      }
    },
    {
      "id": "calendar",
      "label": "Calendar",
      "category": "content",
      "pairModel": "silhouette",
      "meaning": "A date or calendar.",
      "keywords": ["date", "schedule"],
      "availability": {"rounded": {"appearances": ["outline", "filled"], "opticalSizes": [12, 16, 24]}},
      "review": {
        "note": "CORNER_TOKEN body with tabs and a header rail at contour weight. No date marks at 12 or 16 px; a row of three at 24 px.",
        "usage": "Use the action name on the enclosing control; 12 px is for labeled information."
      }
    },
    {
      "id": "sliders",
      "label": "Sliders",
      "category": "actions",
      "pairModel": "silhouette",
      "meaning": "Adjust parameters. Not a funnel filter or gear glyph.",
      "keywords": ["settings", "adjust", "controls"],
      "availability": {"rounded": {"appearances": ["outline", "filled"], "opticalSizes": [12, 16, 24]}},
      "review": {
        "note": "Circular knobs on stadium rails. Two rows at every native size.",
        "usage": "Use the action name on the enclosing control; 12 px is for labeled information."
      }
    },
    {
      "id": "warning",
      "label": "Warning",
      "category": "status-security",
      "pairModel": "silhouette",
      "meaning": "A warning requiring a visible text label in every supported appearance and native size.",
      "keywords": ["caution", "attention"],
      "availability": {"rounded": {"appearances": ["outline", "filled"], "opticalSizes": [12, 16, 24]}},
      "review": {
        "note": "ACUTE_JOIN triangle authored from its corner circles, so the apex stays on the keyline, with capsule stem and circular dot at the gap target. At 12 and 16 px the glyph is centred on a pixel column, a registered 0.5 px offset, so the mark is solid at 1x. Visible-label restriction is concept-level.",
        "usageRestriction": "warning-visible-label"
      }
    },
    {
      "id": "link",
      "label": "Link",
      "category": "content",
      "pairModel": "weight",
      "meaning": "A link or related resource. Not external navigation by itself.",
      "keywords": ["url", "chain"],
      "availability": {"rounded": {"appearances": ["outline", "filled"], "opticalSizes": [12, 16, 24]}},
      "review": {
        "note": "Two capsule rings on one 45-degree axis, woven so that each crosses over the other once, at every master and style. The weave separation and the thinner filled 12 px stroke are registered in catalog/exceptions.json. Requires a visible text label at 12 px.",
        "usage": "Requires a visible text label at 12 px. At 16 and 24 px, use the action name on the enclosing control."
      }
    },
    {
      "id": "branch",
      "label": "Branch",
      "category": "system-data",
      "pairModel": "silhouette",
      "meaning": "A branching relationship. Requires a visible text label at every size.",
      "keywords": ["workflow", "fork"],
      "availability": {"rounded": {"appearances": ["outline", "filled"], "opticalSizes": [12, 16, 24]}},
      "review": {
        "note": "Three circular nodes and round-joined connectors. Outline uses square nodes. The 16 px outline node counters are a registered shortfall against the counter floor.",
        "usage": "Requires a visible text label at every size and appearance. This rule is separate from the Warning restriction record."
      }
    },
    {
      "id": "star",
      "label": "Star",
      "category": "content",
      "pairModel": "silhouette",
      "meaning": "Favorite or rating, with context. Distinct from Focus.",
      "keywords": ["favorite", "rating"],
      "availability": {"rounded": {"appearances": ["outline", "filled"], "opticalSizes": [12, 16, 24]}},
      "review": {
        "note": "Five-point star with round points and round inner notches. STAR_JOIN is ~0.5× outline (0.65 / 0.85 / 1.0); 1.0×+ join collapses mass. Outer radius is sized so filled 24 mass tracks Outline (~0.27 of canvas) rather than sitting ~30% light.",
        "usage": "Use the action name on the enclosing control; 12 px is for labeled information."
      }
    }
  ]
}
